{
  "component": {
    "id": "publisher",
    "description": "C-14: makes a completed run visible in one operation and announces it.",
    "heartbeat_interval_seconds": 5.0
  },
  "clock": {
    "endpoint": "http://clock:8090",
    "routes": {
      "snapshot": "/clock/snapshot",
      "control": "/clock/control"
    },
    "mode": "accelerated",
    "stale_after_gap": 4,
    "timeout_seconds": 5.0
  },
  "seed": {
    "root": 20260826,
    "stream": "publisher"
  },
  "broker": {
    "url": "mqtt://drogna_control@broker:1883",
    "client_id": "publisher",
    "keepalive_seconds": 30
  },
  "logging": {
    "level": "INFO"
  },
  "publisher": {
    "staging": {
      "directory": "/var/lib/drogna/coverage/staging",
      "forecast_file": "forecast.nc",
      "uncertainty_file": "uncertainty.nc",
      "manifest_file": "run.json"
    },
    "catalogue": {
      "root_directory": "/var/lib/drogna/coverage",
      "runs_dirname": "runs",
      "current_pointer": "current",
      "partial_suffix": ".partial",
      "forecast_file": "forecast.nc",
      "uncertainty_file": "uncertainty.nc",
      "manifest_file": "run-manifest.json"
    },
    "collections": {
      "forecast_prefix": "forecast-",
      "uncertainty_prefix": "uncertainty-"
    }
  }
}
